{
  "$schema": "edx-agency/handoff/validator@1",
  "phase": 0,
  "date": "2026-04-07",
  "status": "completed",
  "from": "validator",
  "retryCount": 0,
  "verdict": "PASS",
  "blockingIssues": [],
  "nonBlockingIssues": [
    {
      "issue": "AC-4 and AC-5 not covered by tests",
      "file": "src/server.test.ts",
      "recommendation": "Add config validation tests and log-field tests in phase 0.2 before adding new features that depend on them"
    }
  ],
  "phaseObjectiveAlignment": "ALIGNED",
  "deviation": null
}
